{
  "receipt_id": "receipt-kairos-demo-001",
  "task_id": "kairos-demo-001",
  "issued_at": "2026-07-20T08:01:00Z",
  "risk_level": "medium",
  "approval_state": "pending_human_review",
  "privacy_boundary": "local_only",
  "content_hash": "example-only-not-a-production-hash",
  "notes": "Generated from local demo policy. High-risk external actions require human approval."
}
